{
  "meta": {
    "slug": "desacreditacion",
    "titulo": "La maquinaria de desacreditar",
    "subtitulo": "Cómo se fabrica el descrédito de un opositor cubano: etiquetado coordinado, patologización pseudo-clínica y hostigamiento mediático, desde el oficialismo y desde el propio exilio.",
    "descripcion": "Este expediente documenta un patrón, no un diagnóstico: la desacreditación coordinada de opositores cubanos que no se alinean con la ideología dominante de su entorno, ya sea el oficialismo dentro de la isla o sectores del propio exilio y la diáspora. No es un fenómeno nuevo ni exclusivo de un bando: es una táctica con historia documentada y con vocabulario reconocible que se repite contra blancos distintos por la misma razón, restarles agencia y credibilidad para que su testimonio deje de pesar políticamente.\n\nEl expediente organiza la evidencia en tres capas. La primera es un patrón histórico bien establecido: organizaciones como Cubalex han documentado, con nombres y fechas que van de la década de 1960 hasta 2018, el uso de internamientos y evaluaciones psiquiátricas forzosas contra disidentes cubanos, entre veinte y treinta casos solo en los últimos quince años, concentrados sobre todo en integrantes de las Damas de Blanco y UNPACU. La psiquiatrización del discurso no es una ocurrencia moderna de redes sociales: es una herramienta represiva con historial clínico y político propio, ya empleada mucho antes de que existiera un expediente de un preso liberado al que aplicársela.\n\nLa segunda capa es el hostigamiento mediático transnacional documentado por ICLEP, el Instituto Cubano por la Libertad de Expresión y Prensa: en su informe de 2025 registró treinta y tres ataques a la prensa concentrados en apenas diecisiete víctimas, un patrón de hostigamiento repetido y focalizado, no disperso. El caso del medio independiente elTOQUE, que sufrió una campaña transnacional de desprestigio incluyendo un acto de repudio contra su director fuera de Cuba, es el ejemplo mejor documentado de cómo la descalificación mediática cruza fronteras.\n\nLa tercera capa es el caso ilustrativo que dispara este expediente: la campaña de desprestigio estatal contra el artista y activista Luis Manuel Otero Alcántara tras su salida de prisión y su exilio forzoso en julio de 2026. Medios oficialistas lo calificaron de \"mercenario\" en cuestión de horas, en una pieza replicada de forma coordinada por varios portales afines, un calificativo que la propia prensa independiente señaló como especialmente cínico dado que el mismo Estado lo mantuvo en paradero desconocido durante once días antes de conducirlo al exilio. Junto a esa campaña oficialista circuló, de forma independiente, un artefacto distinto: un mensaje que combinaba intimidación directa con un aparato pseudo-científico que atribuía su conducta pública a mecanismos clínicos como la disociación o el síndrome de Estocolmo. Este expediente examina ese artefacto únicamente por su forma y su función, el envoltorio de autoridad clínica al servicio de silenciar un testimonio, sin reproducir ni evaluar ninguna de sus afirmaciones sobre la persona real que las recibió. Ninguna valoración sobre el estado psicológico de Otero Alcántara ha sido investigada, verificada ni incorporada aquí.\n\nCada afirmación de este expediente conserva su fuente y su estado de verificación. Donde la evidencia fue de fuente única o no pudo cotejarse de primera mano, queda marcada visiblemente como no confirmada; ninguna aparece presentada como un hecho asentado si no lo es.",
    "narracion": "Este expediente documenta una táctica, no un diagnóstico: cómo se fabrica el descrédito de un opositor cubano que no se alinea con la ideología dominante de su entorno, sea el oficialismo dentro de la isla o sectores del propio exilio. Cubalex documentó entre veinte y treinta casos, en los últimos quince años, de disidentes sometidos a evaluaciones psiquiátricas forzosas para descalificarlos como mentalmente inestables, una herramienta represiva con historia que llega hasta los años sesenta. El Instituto Cubano por la Libertad de Expresión y Prensa registró en dos mil veinticinco treinta y tres ataques a la prensa concentrados en diecisiete víctimas, y documentó una campaña transnacional contra el medio independiente elTOQUE. El caso que dispara este expediente es la campaña estatal contra el artista Luis Manuel Otero Alcántara tras su exilio forzoso en julio de dos mil veintiséis: medios oficialistas lo llamaron mercenario en horas, en piezas replicadas de forma coordinada, mientras el mismo Estado lo había mantenido desaparecido once días antes de exiliarlo. Junto a esa campaña circuló un mensaje distinto que combinaba intimidación con un aparato pseudo-científico sobre su conducta. Este expediente examina ese mensaje solo por forma y función: el lenguaje clínico al servicio de silenciar un testimonio, sin evaluar afirmación alguna sobre la persona real. Cada dato conserva su fuente y grado de verificación.",
    "version": "1.0.0",
    "fecha_datos": "2026-07-22",
    "advertencia": "El sujeto de este expediente es la táctica de desacreditación documentada, no ninguna persona nombrada. Ninguna afirmación sobre el estado psicológico de Luis Manuel Otero Alcántara ha sido investigada, verificada ni incorporada: aparece solo como ejemplo ilustrativo, por la forma y función de la campaña que sufrió, nunca como sujeto de diagnóstico."
  },
  "intro": {
    "parrafos": [
      "Cuando un preso político sale de la cárcel, lo que diga y cómo lo diga suele ser sometido a un escrutinio que no se aplica igual a nadie más. Este expediente no trata sobre lo que dijo ninguna persona en particular: trata sobre la maquinaria que decide, sistemáticamente, que lo dicho por un disidente no cuenta salvo que encaje con lo que su entorno político esperaba escuchar.",
      "Esa maquinaria tiene dos frentes documentados en Cuba. Uno es el oficialismo: el aparato de medios estatales que etiqueta a los opositores como mercenarios, criminales comunes o agentes extranjeros para vaciar de legitimidad política su encarcelamiento. El otro es interno al propio exilio y la diáspora: sectores que exigen pureza ideológica o un relato de sufrimiento determinado, y descalifican a quien no lo ofrece exactamente en esos términos.",
      "Ambos frentes comparten una táctica más antigua y más documentada que cualquier caso individual: vestir la descalificación política con el lenguaje de la autoridad clínica. Cubalex documentó ese patrón desde los años sesenta hasta la actualidad. Este expediente lo sitúa primero como fenómeno histórico, y solo después examina el episodio que lo trajo de vuelta a examen en julio de 2026, sin convertir a nadie en el sujeto de un diagnóstico que nadie con autoridad para hacerlo ha emitido."
    ]
  },
  "tacticas": [
    {
      "id": "etiquetado",
      "nombre": "Etiquetado descalificatorio coordinado",
      "definicion": "Calificativos que buscan vaciar de legitimidad política a un opositor (mercenario, criminal común, agente extranjero), replicados de forma simultánea por varios medios o cuentas afines para simular consenso.",
      "frente": "oficialista"
    },
    {
      "id": "patologizacion",
      "nombre": "Patologización pseudo-clínica",
      "definicion": "Atribuir el discurso o la conducta de un disidente a un cuadro clínico (disociación, síndrome de Estocolmo, inestabilidad mental) sin evaluación profesional real, para restarle agencia a su testimonio.",
      "frente": "ambos"
    },
    {
      "id": "hostigamiento_transnacional",
      "nombre": "Hostigamiento mediático transnacional",
      "definicion": "Campañas de desprestigio que siguen a periodistas u opositores fuera de Cuba, incluyendo actos de repudio organizados en el país de acogida.",
      "frente": "oficialista"
    },
    {
      "id": "prueba_pureza",
      "nombre": "Prueba de pureza ideológica",
      "definicion": "Exigir a un disidente recién liberado un relato de sufrimiento o una conducta pública específica como condición para reconocer su autenticidad política.",
      "frente": "diaspora"
    },
    {
      "id": "ataque_credibilidad",
      "nombre": "Ataque a la credibilidad personal",
      "definicion": "Cuestionar la autenticidad o las motivaciones de un opositor a partir de su apariencia, posesiones o conducta pública, en lugar de su historial documentado.",
      "frente": "diaspora"
    }
  ],
  "cronologia": [
    {
      "fecha": "2026 (fecha exacta no verificada en esta pasada)",
      "frente": "oficialista",
      "hecho": "Cubalex sitúa el origen documentado de la patologización psiquiátrica de disidentes cubanos en la década de 1960, con casos como el de Eugenio de Sosa Chabau (1967).",
      "confianza": "corroborada",
      "fuente": "Infobae, feb-2025, citando Mesa-Lago (1991) y Directorio Democrático Cubano (2008)"
    },
    {
      "fecha": "2018",
      "frente": "oficialista",
      "hecho": "Caso de Daniel Llorente, disidente sometido a internamiento psiquiátrico documentado dentro del mismo patrón represivo histórico.",
      "confianza": "corroborada",
      "fuente": "Infobae, feb-2025"
    },
    {
      "fecha": "2025",
      "frente": "oficialista",
      "hecho": "ICLEP documenta en su informe anual una campaña transnacional de descrédito contra el medio independiente elTOQUE, incluyendo un acto de repudio contra su director en Ciudad de México.",
      "confianza": "corroborada",
      "fuente": "ICLEP, informe 2025 (vía Voces del Sur)"
    },
    {
      "fecha": "2025",
      "frente": "oficialista",
      "hecho": "ICLEP registra 33 ataques a la prensa concentrados en solo 17 víctimas, evidenciando hostigamiento repetido y focalizado, no disperso.",
      "confianza": "corroborada",
      "fuente": "ICLEP, informe 2025"
    },
    {
      "fecha": "18-jul-2026",
      "frente": "oficialista",